### DISCUSSION TITLE
Speakers in Remote Subnet possible?

### DISCUSSION THREAD

**Discussion by ralle12345** [TJGigs/Bose-SoundTouch-Hybrid#175] [Q&A]
This question is similar to https://github.com/TJGigs/Bose-SoundTouch-Hybrid/issues/143, but the question is if it's possible to have the speakers in a remote subnet, where the BSTH / HA Server does not have a direkt connection into the segment.

I have set the correct network but the speaker is not discovered there. It is however when the speaker is in the same broadcast domain / subnet as the BSTH / HA Server.

This is while using the HA apps obviously.

**Comment by TJGigs** [comment]
In v4.2 I added the ability to type in a different subnet for the speaker discovery scan on the ENV file and the HA config tab.

\
<img width="1085" height="304" alt="image" src="https://github.com/user-attachments/assets/175b2693-85f9-490d-9b36-92bee82f2ea4" />

**Comment by ralle12345** [comment]
Thanks for the hint, but I already configured that setting, the speaker is not discovered nonetheless. 

Could it be a problem, that the speaker was linked to a different instance of BSTH? That one was living inside the same VLAN as the speaker, while HA does not. What logs would help debugging the problem?Would a factory reset of the speaker solve the problem?

**Comment by TJGigs** [comment]
can you do a general query of all the devices on you local intranet and find what IP's your speakers are assigned to. you should be able to see that in your router. Once BSTH sees the on them on your LAN it will automatically update the NVRAM with the correct configs so no factory reset is required... We just need to know where your speakers are (you manually find their IPs) and then from there I can try to understand why the subnet scan did not find them/

**Reply by ralle12345** [reply]
This is the relevant part uf the configuration of the HA addon:

app_ip: 192.168.254.20
mass_ip: 192.168.254.20
mass_port: 8095
scan_subnet: 192.168.66.0/24
assigned_app_port: 62130

====      BOSE SOUNDTOUCH HYBRID:  V4.2
====             MUSIC ASSISTANT:  v2.9.10

The speaker has 192.168.66.219. I can ping it from the gateway in that subnwt, but not from a host that is not in the same network.

In this document https://gesellix.github.io/Bose-SoundTouch/docs/analysis/TELNET-COMMAND-REFERENCE/#the-network-family--wifi--interfaces i found the command to list the IPs of the speaker when connected to it over port 17000, but I could not find the command to show the routing table. I have the feeling that that's connected to my problem.

**Comment by TJGigs** [comment]
The scan_subnet setting looks fine . When u say  _"I can ping it from the gateway in that subnet, but not from a host that is not in the same network."_ That means there's no route between your networks 254 and 66... so its probably a router/firewall thing, not a BSTH thing. BSTH just does a normal HTTP request to each IP you tell it to scan. If your network won't let that request through  no setting on my end fixes it.

Can you test straight from the HA box itself (192.168.254.20)? 
If you don't have it, add the terminal add-on from the app store. "Terminal & SSH" add-on (Settings > Add-ons > Add-on Store — enable Advanced Mode in your profile if you don't see it).

 Then run:
ping -c 4 192.168.66.219
wget -qO- --timeout=3 http://192.168.66.219:8090/info

That second command is what BSTH does to find speakers. If it fails there on the HA terminal too, then you need a route/firewall rule between .254.0/24 and .66.0/24  allow at least port 8090 both ways.

**Reply by ralle12345** [reply]
There is a route from the HA server into the speaker's subnet. I can reach other devices living in the IOT network from HA just fine. When i sniff traffic in the default gateway, I see the ping request going out to the speaker, but no return traffic. This suggests there is no default route even though the DHCP server provides that in the DHCP offer and the other devices in the network just work.
That's why I asked for a command to show the routing that it's using especially the default route that's configured. 

EDIT: I tried to factory reset the speaker, but I'm not shure if it really reset. When I pressed the "1" + "Vol-" buttons, it counted down from 10 to 1, but stayed on the 1 forever. Is there any telnet command to factory reset?

EDIT2: found it! "sys factorydefault"

**Reply by ralle12345** [reply]
The ST20 is factory resetted. I joined it to the wifi by entering the ST's AP and configuring using the Web-GUI. Now it's showing "Download Soundtoch app" on the display and network status over telnet shows

```
<?xml version="1.0" encoding="UTF-8" ?>
<Status primaryIsUp="true" primaryIPAddress="192.168.66.219" primaryIsWired="false" accessPointIsUp="true" mode="wifiSetup" elapsedMs="12762">
    <interfaceInfo name="lo" type="local" state="up" macAddress="000000000000">
        <ipInfo IPAddress="127.0.0.1" SubnetMask="255.0.0.0" />
    </interfaceInfo>
    <interfaceInfo name="eth0" type="wired" state="down" macAddress="0CAE7D0CA6F2" />
    <interfaceInfo name="wlan0" type="wireless" state="up" macAddress="30451145F0F3">
        <ipInfo IPAddress="192.168.66.219" SubnetMask="255.255.255.0" />
    </interfaceInfo>
    <interfaceInfo name="wlan1" type="wireless" state="up" macAddress="30451145F0F4">
        <ipInfo IPAddress="192.0.2.1" SubnetMask="255.255.255.0" />
    </interfaceInfo>
    <interfaceInfo name="usb0" type="wired" state="down" macAddress="2AAA8E3D8763" />
    <stationStats rssi_dBm="-56" linkSpeed_Mbps="130" noise_dBm="9999" frequency_kHz="2462" width_kHz="20" averageRssi_dBm="-54" txGood_packets="9" txBad_packets="0" rxGood_packets="15" tryAuthenticate="1" tryAssociate="1" connected="1" disconnected="0" handshakeFailed="0" ssidTempDisabled="0" bssid="7a:83:c2:cd:be:bf" />
</Status>
```

**Comment by TJGigs** [comment]
can you run the speaker scan on the tools page now.. your subnet scan would be 192.168.66.0/24

**Reply by ralle12345** [reply]
Still no joy:

[22:15:06] [INFO] [Tools] 🔍 Manual speaker discovery triggered on 192.168.66.0/24
[22:15:07] [INFO] [Tools] 🔍 Discovery complete — found 0 speaker(s).

still the speaker is not pingable from the HA host, but from the defaut router. Could this be a firmware issue?  My ST20 has version 27.0.6 as display on the /update.html page.

**Comment by TJGigs** [comment]
It not firmware you have the latest and last version released.. The issue has to be network routing.  
Can MA inside of HA see the speaker?.

**Reply by ralle12345** [reply]
No, MA inside HA cannot see the spearer either. 

I totally agree that it must be routing, but not between HA and the subnet in question, cause HA can reach other nodes in the same subnet. I can also see that ping packets go out towards the speaker on the device that is the router into this segment. The replys are missing though. The cause for such a behavour could be that there is no default gateway set on the speaker. This is why I asked if there is some command that shows something like this output on a generic linux box:

```
/sbin/route -n
Kernel IP routing table
Destination     Gateway         Genmask         Flags Metric Ref    Use Iface
0.0.0.0         192.168.254.1   0.0.0.0         UG    0      0        0 ens18
```

**Reply by ralle12345** [reply]
I debugged some more and found out that you can get a root shell on the speaker. There I found out that indeed there is a correct routing installed on the box with a default route pointing towards the correct gateway:

```
root@spotty:~# route -n
Kernel IP routing table
Destination     Gateway         Genmask         Flags Metric Ref    Use Iface
0.0.0.0         192.168.66.1    0.0.0.0         UG    0      0        0 wlan0
192.168.66.0    0.0.0.0         255.255.255.0   U     0      0        0 wlan0
203.0.113.0     0.0.0.0         255.255.255.252 U     0      0        0 usb0
```

While logged into the speaker I tcpdumped traffic coming from my HA host while scanning the subnet:

```
root@spotty:~# tcpdump -n -i wlan0 "host 192.168.254.20"
tcpdump: verbose output suppressed, use -v or -vv for full protocol decode
listening on wlan0, link-type EN10MB (Ethernet), capture size 65535 bytes
02:09:01.768478 IP 192.168.254.20.39998 > 192.168.66.219.8090: Flags [S], seq 1534623143, win 64240, options [mss 1460,sackOK,TS val 1640182641 ecr 0,nop,wscale 10], length 0
02:09:02.867460 IP 192.168.254.20.39998 > 192.168.66.219.8090: Flags [S], seq 1534623143, win 64240, options [mss 1460,sackOK,TS val 1640183693 ecr 0,nop,wscale 10], length 0
```

Connections from my HA host are ignored on the speaker, the reason seems to be the firewalling on the system that allows only traffic from the subnet the speaker is in:

```
root@spotty:~# iptables -L -n
Chain INPUT (policy ACCEPT)
target     prot opt source               destination         
DROP       tcp  --  0.0.0.0/0            0.0.0.0/0            tcp dpt:17008
DROP       tcp  --  0.0.0.0/0            0.0.0.0/0            tcp dpt:17008
ACCEPT     all  --  0.0.0.0/0            0.0.0.0/0            ctstate RELATED,ESTABLISHED
DROP       all  --  0.0.0.0/0            0.0.0.0/0           
ACCEPT     all  --  192.168.66.0/24      0.0.0.0/0           
DROP       all  --  0.0.0.0/0            0.0.0.0/0           

Chain FORWARD (policy ACCEPT)
target     prot opt source               destination         

Chain OUTPUT (policy ACCEPT)
target     prot opt source               destination
```

If i flush the iptables then the connections from the HA host are no longer ignored and the speaker is found:

```
root@spotty:init.d# tcpdump -n -i wlan0 "host 192.168.254.20"
tcpdump: verbose output suppressed, use -v or -vv for full protocol decode
listening on wlan0, link-type EN10MB (Ethernet), capture size 65535 bytes
02:31:23.646878 IP 192.168.254.20.49938 > 192.168.66.219.8090: Flags [S], seq 293581983, win 64240, options [mss 1460,sackOK,TS val 1421819424 ecr 0,nop,wscale 10], length 0
02:31:23.647669 IP 192.168.66.219.8090 > 192.168.254.20.49938: Flags [S.], seq 1197671526, ack 293581984, win 28960, options [mss 1460,sackOK,TS val 158364 ecr 1421819424,nop,wscale 4], length 0
02:31:23.690131 IP 192.168.254.20.49938 > 192.168.66.219.8090: Flags [.], ack 1, win 63, options [nop,nop,TS val 1421819608 ecr 158364], length 0
02:31:23.689710 IP 192.168.254.20.49938 > 192.168.66.219.8090: Flags [P.], seq 1:189, ack 1, win 63, options [nop,nop,TS val 1421819608 ecr 158364], length 188
02:31:23.690525 IP 192.168.66.219.8090 > 192.168.254.20.49938: Flags [.], ack 189, win 1877, options [nop,nop,TS val 158369 ecr 1421819608], length 0
02:31:23.695759 IP 192.168.66.219.8090 > 192.168.254.20.49938: Flags [P.], seq 1:347, ack 189, win 1877, options [nop,nop,TS val 158369 ecr 1421819608], length 346
02:31:23.698748 IP 192.168.254.20.49938 > 192.168.66.219.8090: Flags [.], ack 347, win 63, options [nop,nop,TS val 1421819617 ecr 158369], length 0
02:31:23.699476 IP 192.168.66.219.8090 > 192.168.254.20.49938: Flags [P.], seq 347:1316, ack 189, win 1877, options [nop,nop,TS val 158369 ecr 1421819617], length 969
02:31:23.702522 IP 192.168.254.20.49938 > 192.168.66.219.8090: Flags [.], ack 1316, win 66, options [nop,nop,TS val 1421819621 ecr 158369], length 0
02:31:23.705186 IP 192.168.254.20.49938 > 192.168.66.219.8090: Flags [F.], seq 189, ack 1316, win 66, options [nop,nop,TS val 1421819622 ecr 158369], length 0
02:31:23.713951 IP 192.168.66.219.8090 > 192.168.254.20.49938: Flags [F.], seq 1316, ack 190, win 1877, options [nop,nop,TS val 158371 ecr 1421819622], length 0
02:31:23.730955 IP 192.168.254.20.49938 > 192.168.66.219.8090: Flags [.], ack 1317, win 66, options [nop,nop,TS val 1421819636 ecr 158371], length 0
```

from the log on BSTH:

```
[11:10:02] [INFO] [Tools] 🔍 Manual speaker discovery triggered on 192.168.66.0/24
[11:10:04] [INFO] [Tools] 🔍 Discovery complete — found 1 speaker(s).
```
I made this change permanent on my speaker by remounting the / filesystem rw

```mount -o remount,rw /```

which took some seconds to complete and inserted an exit command into the script /etc/init.d/Firewalls/update_iptables that configures the firewalling on the speaker:

```
#!/bin/sh

function usage() {
    cat <<USAGE
usage: $0 [-h] [-nf] [-d|down INTERFACE] INTERFACES...
  Configure a basic firewall for an ECO1 device.

  INTERFACES must be a list of one-or-more upstream network interfaces.
  Traffic received on these interfaces which did not originate from the
  local IP subnet will be blocked (unless part of an ongoing connection).

  The -f, -n/--nat, and -d/--down options provide NAT configuration, and
  replaces equivalent functionality which previously was implemented in
  /etc/init.d/bardeen_nat.sh. These need only be called a single time,
  during initial boot up, and needn't be reinvoked multiple times.

  See: https://jirapro.bose.com/browse/EMBEDSECUR-42

  arguments:
    -h|help display this message and exit
    -d|down specify a downstream network interface
            This interface will received downstream NAT traffic, akin to
            a private network behind a home WiFi route. This only sets
            the filtering rules, see the -n option below.

    -n|nat  configure NAT masquerading and firewall rules
            This is the complement to the -d option above
            to packet filtering rules

    -f      enable IP forwarding (for NAT)
USAGE
    exit 1
}

## added:
exit

ARGS=$(getopt -o hd:nf --long help,down:,nat, -n $0 -- "$@")
[[ $? = 0 ]] || usage $0
```
Now I have a speaker in BSTH, but it is not yet discovered in MA. How can I force that?

**Reply by ralle12345** [reply]
Half an hour later and after multiple "Enforce Player Configs", restarts of MA and BSTH still no speakers in MA, but instead

```
[12:16:54] [INFO] [MASS Utils] ⚠️ Bose SoundTouch 0CA6F2: No matching MASS player found. Skipping config audit.
[12:16:54] [INFO] [MASS Utils] ⚠️ Bose SoundTouch 1BA783: No matching MASS player found. Skipping config audit.
```

**Reply by ralle12345** [reply]
Home Assistant discovered the speakers as DLNA Renderer, but still not found by MA.

**Reply by TJGigs** [reply]
In MA you add your player providers, DLNA and AirPlay and then go into players and MA auto detect them after several seconds. 
It's very interesting you're having these issues. I've never heard of that before. And anyone having to make the change on the speaker that you said you did.  
Is there something very unique about your home network set up?

**Reply by ralle12345** [reply]
Dunno if there's something so special. I think that would need someone else to judge :)

I'm a step further now, but each of the two speakers is detected twice:

<img width="457" height="259" alt="grafik" src="https://github.com/user-attachments/assets/fbb94b20-90ab-4b32-9165-3fbfe6f0edb2" />

**Reply by TJGigs** [reply]
It should have come up as one with AirPlay and DLNA and sendspin.  Perhaps it's something to do with the changing on the speaker?  U made a change in its file system?  
but go in on the AirPlay one and set it as the preferred protocol and then see if you can play music to it from within music assistant.

**Reply by ralle12345** [reply]
I only changed the script that activates the iptables to not drop traffic from outside the local subnet.

I can stream to teh speaker with both Airplay or DLNA. If I read the docs correctly, DLNA should be preferred, right?

BTW: THANKS for the time you invest in helping me with my speakers!

**Reply by TJGigs** [reply]
Either should work and you can read the trade-offs I think it's in my technical document as opposed to the read me I like DLNA because for me it's more stable and quicker. The only downside is the Medi data on the LED display does not get updated between tracks AirPlay does update the data on the LED display (the app itself always displays the recent meta data regardless of the protocol)) and I find that AirPlay is slower to queue up but other people like it better so you can choose either one and you can mix a match but if you can play music now on a speaker from music, assistant directly on DLNA or AirPlay. Well once you verify that then BSTH should be able to
