### ISSUE TITLE
Auto Resume Preset not working for me... intermittent issue  (tj note : debug/fix v3.4 or v3.5)

### ISSUE THREAD

**Issue by Stephens-ely** [TJGigs/Bose-SoundTouch-Hybrid#22]
Hi ya,

I have a issue with Auto Resume Preset but I may be expecting a difference result.

AUTO_RESUME_PRESET=true

BUT...

If I play a preset and then switch off the speaker using the remote control, when I then power the speaker back on using the remote power button, I get a flashing amber light on the ST10 rather than the previous preset playing.

If I power on by pressing a numbered button, it plays that preset.

Is this the expected behaviour or when powering on, should it start playing the last preset used?

**Comment by TJGigs** [comment]
It's supposed  to restart. can u restaart STH and then start a preset from the speaker or app the power off, then power on and send me the log from sty restart all the way down to the log entry...we should see a message about auto-resume

**Comment by Stephens-ely** [comment]
Here's a log on my Kitchen ST10 where it doesn't work.

[hybrid-server-logs-2026-05-08.txt](https://github.com/user-attachments/files/27530264/hybrid-server-logs-2026-05-08.txt)

**Comment by Stephens-ely** [comment]
On further testing, it appears to be intermittent (the worst kindda issue).

Here's another log file where it does seem to work (Kitchen and TV Room ST10s).

When switched on from remote, the amber light comes on.
Sometimes, nothing then happens but some times, after about 10 seconds, the previous preset does start playing.

[hybrid-server-logs-2026-05-08 (2).txt](https://github.com/user-attachments/files/27530809/hybrid-server-logs-2026-05-08.2.txt)

**Comment by Stephens-ely** [comment]
Also, what should be the expected behavior from using the web interface ?  Should that also 'auto resume'?

**Comment by TJGigs** [comment]
yes... pphysical power off and app power off from a already playing preset should resume the same... same behavior

**Comment by Stephens-ely** [comment]
OK - We'll I'm seeing some similar intermittent behaviour there too.

Not sure if it actually shows up in the logs.

**Comment by TJGigs** [comment]
Yes its the same code block so whether it from poweer off on speaker or power off on web app it the same code... So how u power off is not the issue...something else to make it intermittent...right now focusing on the users with preset isseue...trying tto resolve be I leave (see readmee notice)

**Comment by JMG-ux** [comment]
Hello,
For me no intermittence. Here the sequence :
1- ST detected on MA and BSTH => OK
2- Preset 6 plays music accordingly => OK
3-  Power OFF ST during the playing
4- Power ON ST => Solid Yellow LED. Preset 6 no auto resume 
5- Unplung/Replug ST (Wait 5 mn for MA detection) then pushing  ST Power ON ST  => Solid Yellow LED. Preset 6 no auto resume
6- During phases 3 to 5 MA is in Pause. So, now, on MA pressing the Play button effectively resume Preset 6 play list ...

Notes : 
-  If switch OFF/ON is less than 5 mn MA in Parameters/Player status = Always ST as detected ( cf *)



(*) Little Annoyance:
My ST is only detected On MA discovery requests every ... 5 mn (it is long when you Power ON and wanna listen...).
Though BSTH detect the ST immediately (I assume detect SSDP pings from ST)   
 IP 192.168.0.210 = MA
 IP 192.168.0.124 = ST
22:11:17.397415 IP 192.168.0.210.59214 > 255.255.255.255.1900: UDP, length 125
22:16:21.400284 IP 192.168.0.210.44956 > 239.255.255.250.1900: UDP, length 125
22:16:22.465467 IP 192.168.0.124.1900 > 192.168.0.210.44956: UDP, length 376
22:16:25.402309 IP 192.168.0.210.34139 > 255.255.255.255.1900: UDP, length 125
22:21:29.404924 IP 192.168.0.210.48514 > 239.255.255.250.1900: UDP, length 125
22:21:33.212030 IP 192.168.0.124.1900 > 192.168.0.210.48514: UDP, length 376
22:21:33.406090 IP 192.168.0.210.44004 > 255.255.255.255.1900: UDP, length 125

Configuration:
MA and STH v3  installed on Docker DSM6 SYNOLOGY NAS 415+

ST : SoundTouch 10

BSTH with AUTO_RESUME_PRESET=true
MA with resume on power ON checked for the ST player (but same behaviour w/o)

Rem : sorry for typo I'm French native

**Comment by TJGigs** [comment]
Thanks for the info! I will work on when I get back. (See my readme)(
Just fyi the way I built auto resume preset from power on in bsth is managed outside of MA. I just used MA as pass thru back end streaming brain.  Bsth is  not meant to use the ma UI except for initial provider setup. Very vanilla, no local lib, no sync, no speaker grips, schedules etc.  very MA-lite instance. 

I keep track of last played preset on power off and just restart it on power from bsth as if u hit preset button un bsth or speaker.  
So I think it's persistent issue in my bsth not with MA resume if I understand what r describing correctly     I do not use MA  pause except for pause from bsth on control Ui. 

My bsth auto resume is supposed work even if MA has been restarted etc even days later.  Obviously there is issue I need to solve for u and others  so I really appreciate your info!  Just wanted clarify my "auto resume" is managed outside of MA and that I don't even try to sync MA UI actions with Bsth. Thats why MA from my app design perspective is really just a back end process that I talk to and get status from.  Nothing more 
Just fyi in case. 
Regardless I need to get it fixed for u  guys! Thx!

**Comment by JMG-ux** [comment]
Thx a lot for your response TJGigs.And for all your work and dedication I'm very grateful.

As for "Unfortunately, I will be on vacation for 2 weeks (May 9th-26)..." I would not say "Unfortunately" vacations are never ever an unfortunate event but a good thing. Wish U an Happy vacation in Europe/Greece :o)

yes I 'd understood bsth use MA just as a conduit to pass through out but ... 
...What may suggest (but I'm not the expert here) the sequence 6- final point above is that MA seems to keep track of the playing like bsth. And so,a "mismatch" between MA and bsth  would it be possible there for the resuming (?). Just my 2 cents

**Comment by TJGigs** [comment]
fixed in v3.4
